{
  "schemaVersion": 1,
  "metadata": {
    "datasetId": "basic-attack",
    "title": "拂晓舰灵普攻倍率与 CD",
    "version": "2026-07",
    "sourceAssetId": "src-0c5b7db892f6",
    "sourceFileName": "8.2 拂晓舰灵普攻倍率cd.xlsx",
    "sourceUpdatedAt": "2026-07-21",
    "verifiedAt": "2026-07-29",
    "reviewedAt": "2026-07-30",
    "reviewStatus": "approved",
    "publicationStatus": "published",
    "worksheetCount": 7,
    "recordCount": 225,
    "fieldCount": 33,
    "defaultSort": [
      "worksheetOrder",
      "worksheetRow",
      "id"
    ]
  },
  "publicRelease": {
    "body": true,
    "asset": false,
    "searchIndex": true,
    "sitemap": true,
    "download": false,
    "derivative": true,
    "structuredData": true,
    "mode": "public",
    "reason": "公开出口由 authorization.scope 与 deniedScopes 派生。"
  },
  "integrity": {
    "sourceSha256": "0f1e9968adbcd3dcdc669168af97f0f40d5de55f928d645e99a9e30d95bf0379",
    "importRecordsSha256": "4148d782361ea2d3d1f355c1b4f2c7f6835408ec058de312387fc2e3cee75c76",
    "fieldDictionarySha256": "adf9d277d31df3b902b4c4c675c2a912faaaa3a0ef68119857cc3160b165fe1c",
    "recordsSha256": "d3c3eb10c53dc2923b3fad4648173f08f8f172ce09e7a9cb75af7ee76daf0d4d"
  },
  "fields": [
    {
      "name": "worksheet",
      "type": "string",
      "nullable": false,
      "label": "来源工作表",
      "unit": null,
      "description": "记录在授权工作簿中的来源工作表。",
      "searchable": true,
      "sortable": false
    },
    {
      "name": "worksheetRow",
      "type": "number",
      "nullable": false,
      "label": "来源工作表行号",
      "unit": "行",
      "description": "记录在来源工作表中的原始行号，用于追溯与复核。",
      "searchable": false,
      "sortable": false
    },
    {
      "name": "rowNote",
      "type": "string",
      "nullable": true,
      "label": "来源行备注",
      "unit": null,
      "description": "来源行备注；空值表示来源工作表未提供该项。",
      "searchable": true,
      "sortable": false
    },
    {
      "name": "gunMultiplier",
      "type": "number",
      "nullable": true,
      "label": "炮击伤害倍率",
      "unit": "倍率",
      "description": "炮击伤害倍率；空值表示来源工作表未提供该项。",
      "searchable": false,
      "sortable": true
    },
    {
      "name": "gunCdSeconds",
      "type": "number",
      "nullable": true,
      "label": "炮击冷却秒数",
      "unit": "秒",
      "description": "炮击冷却秒数；空值表示来源工作表未提供该项。",
      "searchable": false,
      "sortable": true
    },
    {
      "name": "gunRangeUnits",
      "type": "number",
      "nullable": true,
      "label": "炮击有效射程",
      "unit": "游戏内射程单位",
      "description": "炮击有效射程；空值表示来源工作表未提供该项。",
      "searchable": false,
      "sortable": true
    },
    {
      "name": "gunDamageType",
      "type": "string",
      "nullable": true,
      "label": "炮击伤害类型",
      "unit": null,
      "description": "炮击伤害类型；空值表示来源工作表未提供该项。",
      "searchable": true,
      "sortable": false
    },
    {
      "name": "torpedoMultiplier",
      "type": "number",
      "nullable": true,
      "label": "雷击伤害倍率",
      "unit": "倍率",
      "description": "雷击伤害倍率；空值表示来源工作表未提供该项。",
      "searchable": false,
      "sortable": true
    },
    {
      "name": "torpedoNote",
      "type": "string",
      "nullable": true,
      "label": "雷击备注",
      "unit": null,
      "description": "雷击备注；空值表示来源工作表未提供该项。",
      "searchable": true,
      "sortable": false
    },
    {
      "name": "torpedoCdSeconds",
      "type": "number",
      "nullable": true,
      "label": "雷击冷却秒数",
      "unit": "秒",
      "description": "雷击冷却秒数；空值表示来源工作表未提供该项。",
      "searchable": false,
      "sortable": true
    },
    {
      "name": "torpedoRangeUnits",
      "type": "number",
      "nullable": true,
      "label": "雷击有效射程",
      "unit": "游戏内射程单位",
      "description": "雷击有效射程；空值表示来源工作表未提供该项。",
      "searchable": false,
      "sortable": true
    },
    {
      "name": "projectilesPerRound",
      "type": "string",
      "nullable": true,
      "label": "每轮弹数或架数",
      "unit": "发或架/轮",
      "description": "每轮弹数或架数；空值表示来源工作表未提供该项。",
      "searchable": true,
      "sortable": false
    },
    {
      "name": "mainGunMultiplier",
      "type": "number",
      "nullable": true,
      "label": "主炮伤害倍率",
      "unit": "倍率",
      "description": "主炮伤害倍率；空值表示来源工作表未提供该项。",
      "searchable": false,
      "sortable": true
    },
    {
      "name": "mainGunCdSeconds",
      "type": "number",
      "nullable": true,
      "label": "主炮冷却秒数",
      "unit": "秒",
      "description": "主炮冷却秒数；空值表示来源工作表未提供该项。",
      "searchable": false,
      "sortable": true
    },
    {
      "name": "mainGunRangeUnits",
      "type": "number",
      "nullable": true,
      "label": "主炮有效射程",
      "unit": "游戏内射程单位",
      "description": "主炮有效射程；空值表示来源工作表未提供该项。",
      "searchable": false,
      "sortable": true
    },
    {
      "name": "mainGunDamageType",
      "type": "string",
      "nullable": true,
      "label": "主炮伤害类型",
      "unit": null,
      "description": "主炮伤害类型；空值表示来源工作表未提供该项。",
      "searchable": true,
      "sortable": false
    },
    {
      "name": "mainGunProjectilesPerRound",
      "type": "string",
      "nullable": true,
      "label": "主炮每轮弹数",
      "unit": "发或架/轮",
      "description": "主炮每轮弹数；空值表示来源工作表未提供该项。",
      "searchable": true,
      "sortable": false
    },
    {
      "name": "secondaryGunMultiplier",
      "type": "number",
      "nullable": true,
      "label": "副炮伤害倍率",
      "unit": "倍率",
      "description": "副炮伤害倍率；空值表示来源工作表未提供该项。",
      "searchable": false,
      "sortable": true
    },
    {
      "name": "secondaryGunCdSeconds",
      "type": "number",
      "nullable": true,
      "label": "副炮冷却秒数",
      "unit": "秒",
      "description": "副炮冷却秒数；空值表示来源工作表未提供该项。",
      "searchable": false,
      "sortable": true
    },
    {
      "name": "secondaryGunRangeUnits",
      "type": "number",
      "nullable": true,
      "label": "副炮有效射程",
      "unit": "游戏内射程单位",
      "description": "副炮有效射程；空值表示来源工作表未提供该项。",
      "searchable": false,
      "sortable": true
    },
    {
      "name": "secondaryGunDamageType",
      "type": "string",
      "nullable": true,
      "label": "副炮伤害类型",
      "unit": null,
      "description": "副炮伤害类型；空值表示来源工作表未提供该项。",
      "searchable": true,
      "sortable": false
    },
    {
      "name": "secondaryGunProjectilesPerRound",
      "type": "string",
      "nullable": true,
      "label": "副炮每轮弹数",
      "unit": "发或架/轮",
      "description": "副炮每轮弹数；空值表示来源工作表未提供该项。",
      "searchable": true,
      "sortable": false
    },
    {
      "name": "aircraftMultiplier",
      "type": "number",
      "nullable": true,
      "label": "舰载机伤害倍率",
      "unit": "倍率",
      "description": "舰载机伤害倍率；空值表示来源工作表未提供该项。",
      "searchable": false,
      "sortable": true
    },
    {
      "name": "aircraftCdSeconds",
      "type": "number",
      "nullable": true,
      "label": "舰载机冷却秒数",
      "unit": "秒",
      "description": "舰载机冷却秒数；空值表示来源工作表未提供该项。",
      "searchable": false,
      "sortable": true
    },
    {
      "name": "aircraftRangeUnits",
      "type": "number",
      "nullable": true,
      "label": "舰载机有效射程",
      "unit": "游戏内射程单位",
      "description": "舰载机有效射程；空值表示来源工作表未提供该项。",
      "searchable": false,
      "sortable": true
    },
    {
      "name": "aircraftDamageType",
      "type": "string",
      "nullable": true,
      "label": "舰载机伤害类型",
      "unit": null,
      "description": "舰载机伤害类型；空值表示来源工作表未提供该项。",
      "searchable": true,
      "sortable": false
    },
    {
      "name": "fighterMultiplier",
      "type": "number",
      "nullable": true,
      "label": "战斗机巡航倍率",
      "unit": "倍率",
      "description": "战斗机巡航倍率；空值表示来源工作表未提供该项。",
      "searchable": false,
      "sortable": true
    },
    {
      "name": "fighterCdSeconds",
      "type": "number",
      "nullable": true,
      "label": "战斗机巡航冷却秒数",
      "unit": "秒",
      "description": "战斗机巡航冷却秒数；空值表示来源工作表未提供该项。",
      "searchable": false,
      "sortable": true
    },
    {
      "name": "fighterRangeUnits",
      "type": "number",
      "nullable": true,
      "label": "战斗机巡航有效射程",
      "unit": "游戏内射程单位",
      "description": "战斗机巡航有效射程；空值表示来源工作表未提供该项。",
      "searchable": false,
      "sortable": true
    },
    {
      "name": "attackMultiplier",
      "type": "number",
      "nullable": true,
      "label": "通用普攻伤害倍率",
      "unit": "倍率",
      "description": "通用普攻伤害倍率；空值表示来源工作表未提供该项。",
      "searchable": false,
      "sortable": true
    },
    {
      "name": "attackCdSeconds",
      "type": "number",
      "nullable": true,
      "label": "通用普攻冷却秒数",
      "unit": "秒",
      "description": "通用普攻冷却秒数；空值表示来源工作表未提供该项。",
      "searchable": false,
      "sortable": true
    },
    {
      "name": "attackRangeUnits",
      "type": "number",
      "nullable": true,
      "label": "通用普攻有效射程",
      "unit": "游戏内射程单位",
      "description": "通用普攻有效射程；空值表示来源工作表未提供该项。",
      "searchable": false,
      "sortable": true
    },
    {
      "name": "attackDamageType",
      "type": "string",
      "nullable": true,
      "label": "通用普攻伤害类型",
      "unit": null,
      "description": "通用普攻伤害类型；空值表示来源工作表未提供该项。",
      "searchable": true,
      "sortable": false
    }
  ],
  "worksheets": [
    {
      "id": "worksheet-destroyer",
      "name": "驱逐",
      "slug": "destroyer",
      "order": 0,
      "recordCount": 50,
      "sourceElementId": "src-0c5b7db892f6:worksheet:cf679187b8f49539",
      "fieldNames": [
        "worksheet",
        "worksheetRow",
        "gunMultiplier",
        "gunCdSeconds",
        "gunRangeUnits",
        "gunDamageType",
        "torpedoMultiplier",
        "torpedoNote",
        "torpedoCdSeconds",
        "torpedoRangeUnits",
        "projectilesPerRound"
      ]
    },
    {
      "id": "worksheet-light-cruiser-torpedo-cruiser",
      "name": "轻巡雷巡",
      "slug": "light-cruiser-torpedo-cruiser",
      "order": 1,
      "recordCount": 38,
      "sourceElementId": "src-0c5b7db892f6:worksheet:ff15b03b0a0bb1ed",
      "fieldNames": [
        "worksheet",
        "worksheetRow",